{
  "messageType": "271",
  "schemaVersion": "1.0",
  "correlationId": "3a4b5c6d-7e8f-4a9b-9c0d-1e2f3a4b5c6d",
  "responseId": "SIM-271-000101",
  "respondedAt": "2026-11-03T14:52:09Z",
  "result": "active",
  "plan": {"name": "Test PPO", "groupNumber": "TEST-G778", "coverageStartDate": "2026-01-01"},
  "benefits": [
    {"benefitType": "active-coverage", "serviceTypeCode": "30", "coverageLevel": "individual"},
    {"benefitType": "copay", "serviceTypeCode": "98", "coverageLevel": "individual", "network": "in",
     "timePeriod": "visit", "amount": {"value": "25.00", "currency": "USD"}},
    {"benefitType": "copay", "serviceTypeCode": "98", "coverageLevel": "individual", "network": "out",
     "timePeriod": "visit", "amount": {"value": "60.00", "currency": "USD"}},
    {"benefitType": "deductible", "serviceTypeCode": "30", "coverageLevel": "individual", "network": "in",
     "timePeriod": "calendar-year", "amount": {"value": "1500.00", "currency": "USD"}},
    {"benefitType": "deductible", "serviceTypeCode": "30", "coverageLevel": "individual", "network": "in",
     "timePeriod": "remaining", "amount": {"value": "640.00", "currency": "USD"}},
    {"benefitType": "deductible", "serviceTypeCode": "30", "coverageLevel": "family", "network": "in",
     "timePeriod": "calendar-year", "amount": {"value": "3000.00", "currency": "USD"}},
    {"benefitType": "coinsurance", "serviceTypeCode": "30", "coverageLevel": "individual", "network": "in",
     "percent": "20"},
    {"benefitType": "out-of-pocket", "serviceTypeCode": "30", "coverageLevel": "individual", "network": "in",
     "timePeriod": "calendar-year", "amount": {"value": "5000.00", "currency": "USD"}},
    {"benefitType": "limitation", "serviceTypeCode": "AL", "coverageLevel": "individual", "network": "in",
     "authorizationRequired": true, "message": "Prior authorization required for advanced imaging."}
  ]
}
