{
  "messageType": "271",
  "schemaVersion": "1.0",
  "correlationId": "3a4b5c6d-7e8f-4a9b-9c0d-1e2f3a4b5c6d",
  "responseId": "SIM-271-000102",
  "respondedAt": "2026-11-03T14:52:08Z",
  "result": "inactive",
  "plan": {"name": "Test HMO", "coverageStartDate": "2025-01-01", "coverageEndDate": "2026-06-30"}
}
